id,sender,pubTime,title,startTime,endTime,status,level,severity,severityColor,type,typeName,urgency,certainty,text,related
10119050420260101095407915968701,如东县气象台,2026-01-01T09:54+08:00,如东县气象台发布海区大风黄色预警,2026-01-01T09:54+08:00,2026-01-02T09:54+08:00,active,黄色,Moderate,Yellow,1062,海区大风,,,如东县气象台2026年01月01日09时48分发布海区大风黄色预警信号：受较强冷空气影响，预计1日夜里到2日白天我县海区将出现9级左右的偏北大风。县应急局、县气象局提醒注意防范。,
10130110120260101060041195567452,钦州市气象台,2026-01-01T06:00+08:00,钦州市气象台发布大风蓝色预警信号,2026-01-01T06:00+08:00,2026-01-02T06:00+08:00,active,蓝色,Minor,Blue,1006,大风,,,钦州市气象台2026年1月1日6时0分发布钦南区、钦北区、中马产业园区大风蓝色预警信号：受冷空气影响，预计未来24小时钦州内陆有7级阵风，沿海及北部湾海面有7到8级阵风，请注意防范。,
10119070120260101080904951967224,盐城市气象台,2026-01-01T08:09+08:00,盐城市气象台发布海区大风黄色预警,2026-01-01T08:09+08:00,2026-01-01T20:09+08:00,active,黄色,Moderate,Yellow,1062,海区大风,,,盐城市气象台2026年01月01日08时07分发布海区大风黄色预警信号：受较强冷空气影响，预计1日夜间到2日白天我市海区将出现8到9级的偏北大风，市海事、应急、气象联合提醒做好防范。,
10131020520260101161000437208938,海南省气象局,2026-01-01T16:10+08:00,海南省气象局发布海上大风蓝色预警,2026-01-01T16:12+08:00,2026-01-02T16:12+08:00,active,蓝色,Minor,Blue,1023,海上大风,,,海南省气象局2026年01月01日16时00分发布海上大风四级预警：受冷空气影响，西沙、中沙和南沙群岛附近海面，1日夜间到4日白天，风力6-7级，阵风8-9级。本岛东部和南部海面，1日夜间到3日夜间，风力6-7级，阵风8-9级。北部湾海面，本岛西部海面，1日夜间到3日白天，风力6-7级，阵风8-9级。琼州海峡，1日夜间到2日夜间，风力6级，阵风7-8级。请出行船舶注意防范。,
10130110120260102085020565710294,钦州市气象台,2026-01-02T08:50+08:00,钦州市气象台更新大风蓝色预警信号,2026-01-02T08:50+08:00,2026-01-03T08:50+08:00,update,蓝色,Minor,Blue,1006,大风,,,钦州市气象台2026年1月2日8时50分继续发布钦南区、中马产业园区大风蓝色预警信号：受冷空气影响，预计未来24小时钦州沿海仍有6到7级阵风，北部湾海面有7到8级阵风，请注意防范。,10130110120260101060041195567452
10131020520260102090000742679813,海南省气象局,2026-01-02T09:00+08:00,海南省气象局发布海上大风蓝色预警,2026-01-02T09:03+08:00,2026-01-03T09:03+08:00,update,蓝色,Minor,Blue,1023,海上大风,,,海南省气象局2026年01月02日09时00分继续发布海上大风四级预警：受冷空气影响，西沙、中沙和南沙群岛附近海面，2日白天到4日夜间，风力6-7级，阵风8-9级。本岛东部和南部海面，2日白天到3日夜间，风力6-7级，阵风8-9级。北部湾海面，本岛西部海面，2日白天到3日白天，风力6-7级，阵风8-9级。琼州海峡，2日，风力6级，阵风7-8级。请出行船舶注意防范。,10131020520260101161000437208938
10131020520260102162500413915930,海南省气象局,2026-01-02T16:25+08:00,海南省气象局发布海上大风蓝色预警,2026-01-02T16:25+08:00,2026-01-03T16:25+08:00,update,蓝色,Minor,Blue,1023,海上大风,,,海南省气象局2026年01月02日16时20分继续发布海上大风四级预警：受冷空气影响，西沙、中沙和南沙群岛附近海面，2日夜间到5日白天，风力6-7级，阵风8-9级。本岛东部和南部海面，2日夜间到3日夜间，风力6-7级，阵风8-9级。北部湾海面，本岛西部海面，2日夜间到3日白天，风力6-7级，阵风8-9级。琼州海峡，2日夜间，风力6级，阵风7-8级。请出行船舶注意防范。,10131020520260102090000742679813
10131020520260103090000063483041,海南省气象局,2026-01-03T09:00+08:00,海南省气象局发布海上大风蓝色预警,2026-01-03T09:04+08:00,2026-01-04T09:04+08:00,update,蓝色,Minor,Blue,1023,海上大风,,,海南省气象局2026年01月03日09时10分继续发布海上大风四级预警：受冷空气影响，3日白天到夜间，西沙、中沙和南沙群岛附近海面，本岛东部和南部海面，风力6-7级，阵风8-9级；北部湾海面，本岛西部海面，风力5-6级，阵风7-8级；琼州海峡，风力5-6级，阵风7级。请出行船舶注意防范。,10131020520260102162500413915930
10131020520260103164200081914563,海南省气象局,2026-01-03T16:42+08:00,海南省气象局发布海上大风蓝色预警,2026-01-03T16:44+08:00,2026-01-04T16:44+08:00,update,蓝色,Minor,Blue,1023,海上大风,,,海南省气象局2026年01月03日16时50分继续发布海上大风四级预警：受冷空气影响，3日夜间，西沙、中沙和南沙群岛附近海面，风力6-7级，阵风8-9级；本岛东部和南部海面，风力5-6级，阵风7-8级；琼州海峡，北部湾海面，本岛西部海面，风力5级，阵风6-7级。请出行船舶注意防范。,10131020520260103090000063483041
10128130120260104155700184422696,清远市气象台,2026-01-04T15:57+08:00,清远市气象台发布森林火险红色预警,2026-01-04T15:57+08:00,2026-01-05T15:57+08:00,active,红色,Extreme,Red,1025,森林火险,,,预计未来几天清城区天气持续干燥，森林火险气象等级为五级，林内可燃物极易燃烧，森林火灾极易发生，火势蔓延速度极快，清远市气象台于1月4日15时57分将清城区森林火险橙色预警信号升级为红色，请注意森林防火和家居用火用电安全。,
10130110120260105075844930676766,钦州市气象台,2026-01-05T07:58+08:00,钦州市气象台发布大风蓝色预警信号,2026-01-05T07:58+08:00,2026-01-06T07:58+08:00,active,蓝色,Minor,Blue,1006,大风,,,钦州市气象台2026年1月5日7时58分发布钦南区、中马产业园区大风蓝色预警信号：受冷空气影响，预计未来24小时钦州沿海及北部湾海面有5-6级、阵风7级的偏北大风，请注意防范。,
10112030120260105080200161498878,淄博市气象台,2026-01-05T08:02+08:00,淄博市气象台发布大雾黄色预警,2026-01-05T08:02+08:00,2026-01-06T08:02+08:00,active,黄色,Moderate,Yellow,1017,大雾,,,淄博市气象台2026年01月05日08时02分发布大雾黄色预警信号：目前张店区房镇镇能见度已低于500米，预计今天早晨到上午，张店区、高新区、经开区的大部分乡镇、街道仍将出现能见度小于500米的浓雾，局部能见度小于200米。请注意防范。,
10119030120260106033744650873394,镇江市气象台,2026-01-06T03:37+08:00,镇江市气象台发布大雾黄色预警,2026-01-06T03:37+08:00,2026-01-06T15:37+08:00,active,黄色,Moderate,Yellow,1017,大雾,,,镇江市气象台2026年01月06日03时37分发布大雾黄色预警信号：预计今天凌晨到上午，我市大部分地区将出现能见度小于500米、局部小于200米的浓雾或强浓雾。市应急局和气象局提醒注意防范。,
10130110120260106071450985170698,钦州市气象台,2026-01-06T07:14+08:00,钦州市气象台更新大风蓝色预警信号,2026-01-06T07:14+08:00,2026-01-07T07:14+08:00,update,蓝色,Minor,Blue,1006,大风,,,钦州市气象台2026年1月6日7时14分继续发布钦南区、中马产业园区大风蓝色预警信号：受冷空气影响，预计未来24小时钦州沿海及北部湾海面有5到6级、阵风7到8级偏北大风，请注意防范。,10130110120260105075844930676766
10120040120260106130114825119983,孝感市气象台,2026-01-06T13:01+08:00,孝感市气象台发布大风蓝色预警,2026-01-06T13:01+08:00,2026-01-07T13:01+08:00,active,蓝色,Minor,Blue,1006,大风,,,孝感市气象台2026年01月06日13时01分发布大风蓝色预警信号：预计今天午后到夜间，我市大部地区将出现3～4级偏北风，阵风5～7级，局地可达8级以上，请注意防范。,
10131020520260107084800101434948,海南省气象局,2026-01-07T08:48+08:00,海南省气象局发布寒冷蓝色预警,2026-01-07T08:49+08:00,2026-01-08T08:49+08:00,active,蓝色,Minor,Blue,1034,寒冷,,,海南省气象局2026年01月07日09时00分发布寒冷四级预警：受较强冷空气影响，预计7日夜间至9日夜间，澄迈、临高、定安、儋州、白沙、屯昌、琼中和五指山8个市县的大部分乡镇最低气温将降至10℃及以下，请有关单位和人员做好防范工作。,
10131020520260107110307104937311,儋州市气象台,2026-01-07T11:03+08:00,儋州市气象台发布寒冷橙色预警,2026-01-07T11:03+08:00,2026-01-08T11:03+08:00,active,橙色,Severe,Orange,1034,寒冷,,,儋州市气象台2026年01月07日11时03分发布寒冷橙色预警信号：受冷空气影响，预计07日夜间到08日凌晨，我市那大镇、和庆镇、南丰镇、雅星镇、兰洋镇最低气温将小于10℃，建议有关单位和人员做好防范工作。,
10130110120260107163000923241268,广西壮族自治区气象台,2026-01-07T16:30+08:00,广西壮族自治区气象台发布霜冻蓝色预警信号,2026-01-07T16:30+08:00,2026-01-08T16:30+08:00,active,蓝色,Minor,Blue,1016,霜冻,,,广西区气象台2026年01月07日16时30分发布霜冻蓝色预警，预计：明天早晨，桂林、柳州、贺州、河池、来宾、梧州、贵港、南宁、百色等市及玉林市北部的部分地区有霜冻或冰冻。各地最低气温：高寒山区-5℃～1℃，桂东北1～5℃，其它地区4～9℃。请注意防范。,
10131020520260107161700353229485,海南省气象局,2026-01-07T16:17+08:00,海南省气象局发布寒冷蓝色预警,2026-01-07T16:21+08:00,2026-01-08T16:21+08:00,update,蓝色,Minor,Blue,1034,寒冷,,,海南省气象局2026年01月07日16时30分继续发布寒冷四级预警：受较强冷空气影响，预计7日夜间至9日夜间，澄迈、临高、定安、儋州、白沙、屯昌、琼中和五指山8个市县的大部分乡镇最低气温将降至10℃及以下，请有关单位和人员做好防范工作。,10131020520260107084800101434948
